{
  "$schema": "../asset-manifest.schema.json",
  "batch": "B0",
  "status": "in-progress",
  "styleGuide": "../../ART_STYLEGUIDE.md",
  "assets": [
    {
      "id": "character.blue.rifle.idle",
      "source": "art/source/character_blue_rifle_idle_v01.png",
      "runtime": "public/assets/atlases/characters.png",
      "canvas": [384, 384],
      "pivot": [0.5, 0.68],
      "collisionRadius": 17,
      "approval": "candidate"
    },
    {
      "id": "environment.wall.straight",
      "source": "art/source/environment_wall_straight_v01.png",
      "runtime": "public/assets/atlases/environment.png",
      "canvas": [512, 256],
      "pivot": [0.5, 0.5],
      "approval": "candidate"
    },
    {
      "id": "prop.crate.standard",
      "source": "art/source/prop_crate_standard_v01.png",
      "runtime": "public/assets/atlases/environment.png",
      "canvas": [256, 256],
      "pivot": [0.5, 0.5],
      "collisionFootprint": [0.7, 0.7],
      "approval": "candidate"
    },
    {
      "id": "pickup.medkit.idle",
      "source": "art/source/pickup_medkit_idle_v01.png",
      "runtime": "public/assets/atlases/gameplay.png",
      "canvas": [256, 256],
      "pivot": [0.5, 0.5],
      "approval": "candidate"
    }
  ]
}
